<c_object parent="Object" type="decoration" class_name="Jasmimmanga" xmlns:xsi="http://www.w3.org/2001/XMLSchema-instance" xsi:noNamespaceSchemaLocation="Object.xsd">
 <properties>
    <property name="category" value="trees"/>
    <property name="ent_path" value="assets/decorations/trees/tropicals/jasmimmanga.oe.json"/>
    <property name="pass_path" value="assets/decorations/trees/tropicals/jasmimmanga.pass"/>
  </properties>
  <methods>
    <method name="" script=""/>
  </methods>
  <sounds>
    <sound name="" path=""/>
  </sounds>
</c_object>