<c_object parent="Building" type="building" class_name="ETavern" xmlns:xsi="http://www.w3.org/2001/XMLSchema-instance" xsi:noNamespaceSchemaLocation="Object.xsd">
 <properties>
    <property name="race" value="Egypt"/>
    <property name="radius" value="1000"/>
    <property name="isCentralBuilding" value="0"/>
    <property name="category" value="egyptianstronghold"/>
    <property name="ent_path" value="assets/buildings/egypt/tavern/etavern.oe.json"/>
    <property name="pass_path" value="assets/buildings/egypt/tavern/etavern.pass"/>
    <property name="clickable_in_minimap" value="0"/>
  </properties>
  <methods>
    <method name="" script=""/>
  </methods>
  <sounds>
    <sound name="select" path="sounds/eTavernSelect.ogg"/>
  </sounds>
</c_object>